{
  "schemaVersion": "0.1.0",
  "verificationId": "CC-SV-QPCR-CREATION-REVOKED-001",
  "recordVersion": "0.1.0",
  "vectorType": "negative",
  "signatureId": "SIG-QPCR-CREATION-REVOKED-001",
  "keyRef": "CC-TK-CREATORS-COMMON-ED25519-001",
  "authorityRef": "CC-SA-CREATORS-COMMON-ENVELOPE-001",
  "algorithm": "Ed25519",
  "messageProfile": "CC-SIG-0.1",
  "signedMessage": "CC-SIG-0.1\nenvelopeId=CC-EN-QPCR-CREATION-REVOKED-TEST-001\nenvelopeVersion=0.1.0\nrecordType=creation\nrecordId=CC-CP-QPCR-CREATOR-PROGRAMME-001\nrecordVersion=0.1.0\ncanonicalization=CC-CJSON-0.1\ndigestAlgorithm=sha-256\ndigestValue=fd09c2f02fd10d7bdfa3a200aab390794f495783ce74a2d8a8a8f66813cd66bd",
  "signatureValue": "mvd6H5TNArnw69pMcDXxRTh1YLLjMksiXMdzBmTn_slA7WF22rRRdQdFLgmeQSc1uALj9xhttIzLiWrFJw4TCw",
  "verificationContext": {
    "recordType": "creation",
    "action": "issue",
    "scope": "payload-digest",
    "purpose": "registry-issuance",
    "environment": "creators-common-registry",
    "verifiedAt": "2026-07-14T10:28:00Z"
  },
  "expected": {
    "cryptographicResult": "valid",
    "trustResult": "revoked",
    "overall": "failed"
  },
  "observed": {
    "cryptographicResult": "valid",
    "trustResult": "revoked",
    "overall": "failed",
    "reasonCodes": [
      "SIGNATURE-VALID",
      "KEY-REVOKED",
      "TRUST-FAILED"
    ]
  },
  "testMutation": "The signature is cryptographically valid, but the referenced key is revoked at verification time.",
  "verifier": {
    "serviceId": "CC-SVC-SIGNATURE-VERIFIER",
    "implementationVersion": "0.1.0"
  },
  "issuer": {
    "issuerId": "CC-INST-WARDEN",
    "name": "Warden",
    "authorityRef": "docs/security/CC-TRUSTED-KEYS-AND-SIGNATURES-V0.1.md"
  },
  "provenance": {
    "sourceRecordRefs": [
      "CC-TK-CREATORS-COMMON-ED25519-001",
      "CC-KE-CREATORS-COMMON-REVOKE-003"
    ],
    "changeReason": "Negative revoked-key trust vector"
  },
  "createdAt": "2026-07-14T10:28:00Z"
}
